{"minimum_distinct_environments":2,"minimum_independent_participants":2,"protocol_sha256":"aaaaaaaaaaaaaaaaaaaaaaaaaaaaaaaaaaaaaaaaaaaaaaaaaaaaaaaaaaaaaaaa","records":[{"consent_review":"verified","disposition":"accepted","host_independence_review":"verified","participant_independence_review":"verified","private_consent_record_sha256":"cccccccccccccccccccccccccccccccccccccccccccccccccccccccccccccccc","private_host_record_hash_nonce_hardened":true,"private_host_record_sha256":"1111111111111111111111111111111111111111111111111111111111111111","private_identity_record_sha256":"bbbbbbbbbbbbbbbbbbbbbbbbbbbbbbbbbbbbbbbbbbbbbbbbbbbbbbbbbbbbbbbb","public_participant_id":"participant-0123456789abcdef","receipt_binding_review":"verified","submission_sha256":"c72fdab0cb7e603499126f8311effc2f637cf56ce2caa76ddc69482660782fe6"},{"consent_review":"verified","disposition":"accepted","host_independence_review":"verified","participant_independence_review":"verified","private_consent_record_sha256":"eeeeeeeeeeeeeeeeeeeeeeeeeeeeeeeeeeeeeeeeeeeeeeeeeeeeeeeeeeeeeeee","private_host_record_hash_nonce_hardened":true,"private_host_record_sha256":"2222222222222222222222222222222222222222222222222222222222222222","private_identity_record_sha256":"dddddddddddddddddddddddddddddddddddddddddddddddddddddddddddddddd","public_participant_id":"participant-fedcba9876543210","receipt_binding_review":"verified","submission_sha256":"8905e4a48c17e598cee49cb8aaeb7865532b68e5fabd70da658674f364f08e13"}],"reviewed_at":"2026-08-24T09:10:00Z","schema":"dl-external-trial-cohort-review-plan/v1"}
